,id,author_id,like_count,quote_count,reply_count,retweet_count,referenced_tweet_id,referenced_tweet_type,text
0,11336767045,24457403,0,0,0,0,,,Wow! Just saw the trailer for Christopher Nolan's new movie #Inception. Can't wait!! http://bit.ly/7H8vca
1,11290194038,37310442,0,0,0,0,,,Lets get a head start! #princeofpersia #thelastairbender #inception
2,11243575211,53664137,0,0,0,0,,,Mind twister! I like it!!! http://bit.ly/brvCe5 #Inception #LeonardoDiCaprio
3,11242759838,616283,0,0,0,0,,,"Nice interview with Chris Nolan and wife/producer Emma Thomas, about new #film #Inception: http://bit.ly/9HrId2"
4,11227232089,15612058,0,0,0,0,,,"Hollywood's Best Director, Christopher Nolan, gets some spotlight on my blog. http://bit.ly/c5yrN3 #movies #Inception #ShoWest @WarnerBros"
5,11116877787,15612058,0,0,0,0,,,Word round the campfire is Nolan shot Inception on VistaVision instead of IMAX... hmmm #movies #Inception
6,11113326636,61598423,0,0,0,0,,,Good read &gt; Christopher Nolan interview about upcoming INCEPTION movie http://bit.ly/9P8Xvp #movies #inception #interview
7,11087281037,23510238,0,0,0,0,,,"Christopher Nolan Filmed Some of #Inception Using 65mm, Calls 3D “An Interesting Development” | /Film http://viigo.im/2UCJ"
8,11077952511,48145135,0,0,0,0,,,#Christopher_Nolan #Inception on 1 Fav Source+1 other like /Film-Christopher Nolan Filmed Some of Inception Using ... http://bit.ly/cizxl4
9,10858608165,39444565,0,0,0,0,,,#Inception.... ....An idea can transform the world and rewrite all the rules. Which is why I have to steal it.
10,10858597408,39444565,0,0,0,0,,,"#Inception. What's the most resilient parasite? An Idea, A single idea from the human mind can build cities..."
11,10831720859,73190612,0,0,0,0,,,My new 'I can't wait' film - #Inception http://inceptionmovie.warnerbros.com/
12,10752353684,64803251,0,0,0,0,,,"My most anticipated movie of 2010 is...drum roll please...""#INCEPTION..."
13,10746629766,44908912,0,0,0,0,,,"If you loved The Dark Knight (2nite on Max) you’ll love Nolan’s new movie, Inception: http://ow.ly/1nXQ2 #inception"
14,10745092849,23510238,0,0,0,0,,,"RT @ThePlaylist: Christopher Nolan Talks #Inception At ShoWest, New Footage Unveiled http://bit.ly/b90ynI"
15,10720253298,22789086,0,0,0,0,,,Chris Nolan Reveals More #Inception Secrets - ComingSoon.net http://ow.ly/1opMv #ShoWest2010
16,10628849580,22752169,0,0,0,0,,,I suggest using #RUP milestones for the #semat project ;-) Seems like there is quite some #inception to do. Anyone for #scrum or #Prince2?
17,10593321178,18056995,0,0,0,0,,,DiCaprio Says Inception Literally Has “Multiple Narratives Simultaneously” http://bit.ly/c53tqO (TheMovieMash.com) #Inception #MovieNews
18,10570364454,38642435,0,0,0,0,,,#Leonardo #DiCaprio Discusses 'Inception' :: http://tinyurl.com/ygw4uuq #inception #movienews
19,10530296625,14656908,0,0,0,0,,,RT @fusedfilm Top 10 Movies We Can’t Wait To Se.. http://bit.ly/9U42Vb #Inception #Jonah #Hex #Prince #of #The #Sands #10
20,10503788786,39556507,0,0,0,0,,,Also cant wait for the release of #Inception. Its Chris Nolan all over me 2day...(smile)
21,10388070592,24283080,0,0,0,1,10374785510,retweeted,RT @AwardsCircuitEd: I'm gonna call Christopher Nolan and ask him if he'll let me watch #Inception because I can't wait this long for it ...
22,10374785510,60100860,0,0,0,1,,,"I'm gonna call Christopher Nolan and ask him if he'll let me watch #Inception because I can't wait this long for it.  He'll say yes, right?"
23,10339069765,65267078,0,0,0,0,,,I Cant Wait to See The Movie #Inception DiCaprio Goes the Fuck in! #Summer2010
24,10333295962,14452404,0,0,0,0,,,can't wait to see 'inception'. whoa! #inception
25,10332289550,23510238,0,0,0,0,,,"Nolan Explains What To Expect From #Batman3, #Inception And The New #Superman | io9.com http://viigo.im/2IS5"
26,10326654778,47257521,0,0,0,0,,,"RT @io9: Nolan Explains What To Expect From Batman 3, Inception And The New Superman http://io9.com/5490746/ #inception #batman"
27,10326430265,60745555,0,0,0,0,,,"Nolan Explains What To Expect From Batman 3, Inception And The New Superman http://io9.com/5490746/ #inception #batman - batman 3!!!!"
28,10324597622,60745555,0,0,0,0,,,"Nolan Explains What To Expect From Batman 3, Inception And The New Superman http://io9.com/5490746/ #inception #batman"
29,10324311464,84309031,0,0,0,4,10324250029,retweeted,"RT @io9: Nolan Explains What To Expect From Batman 3, Inception And The New Superman http://io9.com/5490746/ #inception #batman"
30,10324295966,54449164,0,0,0,4,10324250029,retweeted,"RT @io9: Nolan Explains What To Expect From Batman 3, Inception And The New Superman http://io9.com/5490746/ #inception #batman"
31,10324265021,20476318,0,0,0,4,10324250029,retweeted,"RT @io9: Nolan Explains What To Expect From Batman 3, Inception And The New Superman http://io9.com/5490746/ #inception #batman"
32,10324250029,13215132,1,0,0,4,,,"Nolan Explains What To Expect From Batman 3, Inception And The New Superman http://io9.com/5490746/ #inception #batman"
33,10314870554,14124830,0,0,0,0,,,"#Inception has me stoked! I love and trust Chris Nolan, and Leo and gained my utmost respect with his last few movies, it'll be incredible!"
34,10300906778,23510238,0,0,0,0,,,RT @GeekTyrant: #INCEPTION Plot Details and Running Time Confirmed http://su.pr/1RUfQL
35,10293171667,24967795,0,0,0,0,,,"I think #Inception might be the best movie coming out this summer, and I'm pumped Nolan is capping off his Batman Trilogy"
36,10268779737,23510238,0,0,0,0,,,"New #Inception Tidbits: Plot Details Confirmed, Running Time and Conception | /Film http://viigo.im/2HHY"
37,10241475444,47744662,0,0,0,0,,,"Just seen the trailer for #inception and I have no idea what it's about, except that it looks great and I want to see it!"
38,10143599372,4542961,0,0,0,0,10143490224,replied_to,@gubatron Yeap! And also reminds me of one of my lucid drems. #inception
39,10143490224,802225,0,0,0,0,,,@GustavoTv didn't #Inception remind you of Dark City? (when the city was sort of bending over itself)
40,10142667930,4542961,0,0,0,0,10142069559,replied_to,@gubatron It looks promising! #Inception
41,10036913157,49647698,0,0,0,0,,,Cant wait 4 #Inception watch trailer http://www.youtube.com/watch?v=7DwuVKfjctk
42,9883558577,67540314,0,0,0,0,,,Shocked after watching the #Inception trailer!!! SO COOL!!!!
43,9870228786,117879850,0,0,0,0,,,"Hoovering the walls in cinema.  Like real life #Inception, only cheaper."
